{
  "contract_version": "console_finding_0_1",
  "profile_id": "console_profile_0_1",
  "finding_id": "finding_proposal_contradiction",
  "observation_id": "observation_proposal_contradiction",
  "package_id": "lantern_labs",
  "domain_id": "fictional_lesson_support",
  "package_revision": "1.0.0",
  "artifact_digest": "sha256:e4fd8da08bf9635d4753d8d70be77caa4aae59e756f72d9a9b177bca4603b335",
  "request_id": "request_valid_lantern",
  "request_digest": "sha256:6f05d34af62a1df31dff37133580c3a57cf45fa181663a804cc35fdf0baebe71",
  "candidate_digest": "sha256:1eb12d81b9766254c61281524d9c18cd68ec9027ec65f4f059944b4638ed2b19",
  "target_id": "target_proposal_contradiction",
  "target_digest": "sha256:f6b6878ae664c1c3cab42efe594fe81613a7cf92cac5e02d00ae16b3989281f4",
  "evaluator_role": "contradiction_cross_check",
  "target_role": "proposal_union",
  "classification": "supported",
  "constraint_plan_id": "fictional_lesson_constraints",
  "constraint_plan_revision": "1.0.0"
}
