{
  "contract_version": "console_finding_0_1",
  "profile_id": "console_profile_0_1",
  "finding_id": "finding_visible_grounding",
  "observation_id": "observation_visible_grounding",
  "package_id": "lantern_labs",
  "domain_id": "fictional_lesson_support",
  "package_revision": "1.0.0",
  "artifact_digest": "sha256:e4fd8da08bf9635d4753d8d70be77caa4aae59e756f72d9a9b177bca4603b335",
  "request_id": "request_valid_lantern",
  "request_digest": "sha256:6f05d34af62a1df31dff37133580c3a57cf45fa181663a804cc35fdf0baebe71",
  "candidate_digest": "sha256:1eb12d81b9766254c61281524d9c18cd68ec9027ec65f4f059944b4638ed2b19",
  "target_id": "target_visible_unit_grounding",
  "target_digest": "sha256:73fadba709376ab7df86ad957e8759f0139775889c994738d6da44c2c0748267",
  "evaluator_role": "evidence_relation",
  "target_role": "visible_unit_union",
  "classification": "supported",
  "constraint_plan_id": "fictional_lesson_constraints",
  "constraint_plan_revision": "1.0.0"
}
