{
  "contract_version": "console_finding_0_1",
  "profile_id": "console_profile_0_1",
  "finding_id": "finding_request_coverage",
  "observation_id": "observation_request_coverage",
  "package_id": "lantern_labs",
  "domain_id": "fictional_lesson_support",
  "package_revision": "1.0.0",
  "artifact_digest": "sha256:e4fd8da08bf9635d4753d8d70be77caa4aae59e756f72d9a9b177bca4603b335",
  "request_id": "request_valid_lantern",
  "request_digest": "sha256:6f05d34af62a1df31dff37133580c3a57cf45fa181663a804cc35fdf0baebe71",
  "candidate_digest": "sha256:1eb12d81b9766254c61281524d9c18cd68ec9027ec65f4f059944b4638ed2b19",
  "target_id": "target_request_coverage",
  "target_digest": "sha256:02e512ba1eedf2d9fad53cb715b692c4a54fa470272c22873f57d2462e305046",
  "evaluator_role": "synthesis_coverage",
  "target_role": "request_coverage",
  "classification": "covered",
  "constraint_plan_id": "fictional_lesson_constraints",
  "constraint_plan_revision": "1.0.0"
}
